{
  "schema_version": "1.0.0",
  "design_doc_ref": "system-design-{PROJECT_SLUG}.md",
  "project_name": "{PROJECT_NAME}",
  "generated_at": "{ISO_TIMESTAMP}",
  "last_synced_at": "{ISO_TIMESTAMP}",
  "last_modified_by": "claude",
  "etag": "{INITIAL_ETAG}",
  "workflow_stages": [
    { "id": "design",  "name": "System Design",  "owner_plugin": "system-design-doc", "order": 1 },
    { "id": "mockup",  "name": "UI Mockup",      "owner_plugin": "ui-mockup",         "order": 2 },
    { "id": "code",    "name": "Implementation", "owner_plugin": "long-running",      "order": 3 },
    { "id": "qa",      "name": "QA Testing",     "owner_plugin": "qa-ui-test",        "order": 4 },
    { "id": "release", "name": "Release Gate",   "owner_plugin": "long-running",      "order": 5 }
  ],
  "design_system": {
    "masters":    [],
    "templates":  [],
    "navs":       [],
    "components": []
  },
  "application": {
    "pages":              [],
    "apis":               [],
    "middlewares":        [],
    "external_functions": []
  },
  "edges": [],
  "sync_status": {
    "ui_mockup":    { "covered": 0, "gap": 0, "last_sync": "{ISO_TIMESTAMP}" },
    "long_running": { "covered": 0, "gap": 0, "last_sync": "{ISO_TIMESTAMP}" },
    "qa_tracker":   { "covered_acs": 0, "gap_acs": 0, "last_sync": "{ISO_TIMESTAMP}" }
  }
}
